Query,Response
 Directory available?            , Information about the availability of a directory is not mentioned. You may want to check with building staff for such resources. 
 Is there Wi-Fi on the 8th floor?       , The availability of Wi-Fi on the 8th floor is not specified in the provided information. You may inquire with building staff for Wi-Fi access details. 
 Are there power outlets on the 10th floor? , Information about power outlets on the 10th floor is not mentioned. You may need to inquire with building staff or explore the floor for outlets. 
 Is there a water dispenser on the 2nd floor? , The presence of a water dispenser on the 2nd floor is not mentioned. You may want to inquire with building staff or explore the floor for water facilities. 
 Are there study tables on the 6th floor?  , Information about study tables on the 6th floor is not provided. You may inquire with building staff or explore the floor for study areas. 
 Are there vending machines on the 4th floor? , The presence of vending machines on the 4th floor is not mentioned. You may want to inquire with building staff or explore the floor for vending options. 
 Is there a microwave on the 7th floor? , Information about the availability of a microwave on the 7th floor is not specified. You may need to inquire with building staff or explore the floor for such facilities. 
 How many classrooms on the 9th floor? , The number of classrooms on the 9th floor is not provided. You may want to inquire with building staff or explore the floor for classroom information. 
 Can I find restrooms on the 5th floor? , Directions to restrooms on the 5th floor are not mentioned. You may need to inquire with building staff or explore the floor for restroom facilities. 
 Is there a printer on the 3rd floor? , Information about the availability of a printer on the 3rd floor is not specified. You may need to inquire with building staff or explore the floor for printing services. 
 Do elevators on the 1st floor go to the basement? , Information about elevator access to the basement from the 1st floor is not provided. You may want to inquire with building staff for basement access details. 
 Can I find Wi-Fi on any specific floor? , The information does not specify the availability of Wi-Fi on any specific floor. 
 Is there a microwave mentioned for any particular floor? , The information does not specify the availability of a microwave on any particular floor. 
 Are power outlets mentioned for any specific floor? , The information does not mention power outlets on any specific floor. 
 Is there information about water coolers on any floor? , The information does not mention water coolers on any specific floor. 
 Are vending machines mentioned for any particular floor? , The information does not mention vending machines on any specific floor. 
 Is there any information about photocopiers on any floor? , The information does not mention photocopiers on any specific floor. 
" Do elevators go to the rooftop, as per the provided information? ", The information does not mention elevator access to the rooftop. 
 Is there a garden mentioned for any specific floor? , The information does not mention a garden on any specific floor. 
 Are conference rooms mentioned for any particular floor? , The information does not mention conference rooms on any specific floor. 
 Are lounge areas mentioned for any specific floor? , The information does not mention lounge areas on any specific floor. 
Where is CYNTHIA T located?,"CYNTHIA T is situated at 810, EIGHTH Floor, CENTRAL BLOCK."
Can you tell me the office location of RAJESH KANNA R?,"RAJESH KANNA R's office is at 877, EIGHTH Floor, CENTRAL BLOCK."
Inform me about the whereabouts of SAGAYA AURELIA P.,"SAGAYA AURELIA P is located at 622, FIRST Floor, BLOCK II."
Where can I find HUBERT SHANTHAN's office?,"HUBERT SHANTHAN's office is situated at 877, EIGHTH Floor, CENTRAL BLOCK."
Guide me to the office of DEEPA V JOSE.,"DEEPA V JOSE is located at 881, EIGHTH Floor, CENTRAL BLOCK."
Tell me where NIZAR BANU P K is situated.,"NIZAR BANU P K is located at 810, EIGHTH Floor, CENTRAL BLOCK."
Where can I find ASHOK IMMANUEL V's office?,"ASHOK IMMANUEL V is located at 624, FIRST Floor, BLOCK II."
Tell me the location of CECIL DONALD A.,"CECIL DONALD A's office is situated at 185, FIRST Floor, CENTRAL BLOCK."
Can you provide the whereabouts of CHANDRA J?,"CHANDRA J is located at 880, EIGHTH Floor, CENTRAL BLOCK."
Locate CYNTHIA T's office.,"CYNTHIA T's office is at 810, EIGHTH Floor, CENTRAL BLOCK."
Inform me about the whereabouts of DEEPA V JOSE.,"DEEPA V JOSE is located at 881, EIGHTH Floor, CENTRAL BLOCK."
Where is GOBI R situated?,"GOBI R is situated at 876, EIGHTH Floor, CENTRAL BLOCK."
Provide the location of HUBERT SHANTHAN.,"HUBERT SHANTHAN's office is at 877, EIGHTH Floor, CENTRAL BLOCK."
Tell me where to find KAVITHA R.,"KAVITHA R's office is located at 882, EIGHTH Floor, CENTRAL BLOCK."
Give me the location of LOKANAYAKI K's office.,"LOKANAYAKI K's office is at 612, SECOND Floor, BLOCK II."
Where is NISHA VARGHESE located?,"NISHA VARGHESE is located at 874, EIGHTH Floor, CENTRAL BLOCK."
Guide me to NIZAR BANU P K's office.,"NIZAR BANU P K's office is at 810, EIGHTH Floor, CENTRAL BLOCK."
Locate POORNIMA N V's office.,"POORNIMA N V's office is at 622, SECOND Floor, BLOCK II."
Tell me the whereabouts of PRABU P.,"PRABU P is located at 875, EIGHTH Floor, CENTRAL BLOCK."
Inform me about the location of RAJESH KANNA R.,"RAJESH KANNA R is located at 877, EIGHTH Floor, CENTRAL BLOCK."
Where can I find ROHINI V's office?,"ROHINI V's office is at 12, FIRST Floor, BLOCK II."
Guide me to SAGAYA AURELIA P's office.,"SAGAYA AURELIA P's office is at 622, FIRST Floor, BLOCK II."
Inform me about the whereabouts of SANDEEP J.,"SANDEEP J is located at 622, FIRST Floor, BLOCK II."
Tell me where SENTHILNATHAN T's office is.,"SENTHILNATHAN T's office is at 816, EIGHTH Floor, CENTRAL BLOCK."
Where is SHONEY SEBASTIAN's office situated?,"SHONEY SEBASTIAN's office is on the GROUND Floor, R & D Block."
Provide the location of SOMNATH SINHA.,"SOMNATH SINHA is located at 878, EIGHTH Floor, CENTRAL BLOCK."
Inform me about the whereabouts of SRIDEVI R.,"SRIDEVI R is situated at 810, EIGHTH Floor, CENTRAL BLOCK."
Where can I find SUDHAKAR T's office?,"SUDHAKAR T's office is at 878, EIGHTH Floor, CENTRAL BLOCK."
Guide me to SURESH K's office.,"SURESH K's office is at 810, EIGHTH Floor, CENTRAL BLOCK."
Tell me the location of THIRUNAVUKKARASU V's office.,"THIRUNAVUKKARASU V's office is at 879, EIGHTH Floor, CENTRAL BLOCK."
Inform me about the whereabouts of VAIDHEHI V.,"VAIDHEHI V is located at 879, EIGHTH Floor, CENTRAL BLOCK."
Where is ASHOK IMMANUEL V?,"ASHOK IMMANUEL V is located at 624, FIRST Floor, BLOCK II."
Where is CECIL DONALD A?,"CECIL DONALD A is located at 185, FIRST Floor, CENTRAL BLOCK."
Where is CHANDRA J?,"CHANDRA J is located at 880, EIGHTH Floor, CENTRAL BLOCK."
Where is CYNTHIA T?,"CYNTHIA T is located at 810, EIGHTH Floor, CENTRAL BLOCK."
Where is DEEPA V JOSE?,"DEEPA V JOSE is located at 881, EIGHTH Floor, CENTRAL BLOCK."
Where is GOBI R?,"GOBI R is located at 876, EIGHTH Floor, CENTRAL BLOCK."
Where is HUBERT SHANTHAN?,"HUBERT SHANTHAN is located at 877, EIGHTH Floor, CENTRAL BLOCK."
Where is KAVITHA R?,"KAVITHA R is located at 882, EIGHTH Floor, CENTRAL BLOCK."
Where is LOKANAYAKI K?,"LOKANAYAKI K is located at 612, SECOND Floor, BLOCK II."
Where is NISHA VARGHESE?,"NISHA VARGHESE is located at 874, EIGHTH Floor, CENTRAL BLOCK."
Where is NIZAR BANU P K?,"NIZAR BANU P K is located at 810, EIGHTH Floor, CENTRAL BLOCK."
Where is POORNIMA N V?,"POORNIMA N V is located at 622, SECOND Floor, BLOCK II."
Where is PRABU P?,"PRABU P is located at 875, EIGHTH Floor, CENTRAL BLOCK."
Where is RAJESH KANNA R?,"RAJESH KANNA R is located at 877, EIGHTH Floor, CENTRAL BLOCK."
Where is ROHINI V?,"ROHINI V is located at 12, FIRST Floor, BLOCK II."
Where is SAGAYA AURELIA P?,"SAGAYA AURELIA P is located at 622, FIRST Floor, BLOCK II."
Where is SANDEEP J?,"SANDEEP J is located at 622, FIRST Floor, BLOCK II."
Where is SENTHILNATHAN T?,"SENTHILNATHAN T is located at 816, EIGHTH Floor, CENTRAL BLOCK."
Where is SHONEY SEBASTIAN?,"SHONEY SEBASTIAN is the Director, located on the GROUND Floor, R & D Block."
Where is SOMNATH SINHA?,"SOMNATH SINHA is located at 878, EIGHTH Floor, CENTRAL BLOCK."
Where is SRIDEVI R?,"SRIDEVI R is located at 810, EIGHTH Floor, CENTRAL BLOCK."
Where is SUDHAKAR T?,"SUDHAKAR T is located at 878, EIGHTH Floor, CENTRAL BLOCK."
Where is SURESH K?,"SURESH K is located at 810, EIGHTH Floor, CENTRAL BLOCK."
Where is THIRUNAVUKKARASU V?,"THIRUNAVUKKARASU V is located at 879, EIGHTH Floor, CENTRAL BLOCK."
Where is VAIDHEHI V?,"VAIDHEHI V is located at 879, EIGHTH Floor, CENTRAL BLOCK."
"""hello""","""Hello, how are you ?"""
